{
  "schema_version": 1,
  "target": "example.com",
  "assets": [
    {
      "host": "api.example.com",
      "ips": [],
      "alive": null,
      "attribution": "active",
      "sources": [
        "echo-tool-active"
      ]
    },
    {
      "host": "mail.example.com",
      "ips": [],
      "alive": null,
      "attribution": "passive",
      "sources": [
        "echo-tool"
      ]
    },
    {
      "host": "probe.example.com",
      "ips": [],
      "alive": null,
      "attribution": "passive",
      "sources": [
        "echo-probe"
      ]
    },
    {
      "host": "www.example.com",
      "ips": [],
      "alive": null,
      "attribution": "both",
      "sources": [
        "echo-tool",
        "echo-tool-active"
      ]
    }
  ],
  "quarantine": []
}
